{
  "$id": "https://argus.dev/contracts/impact-edge-page/v1/schema.json",
  "$schema": "https://json-schema.org/draft/2020-12/schema",
  "$ref": "#/$defs/ImpactEdgePageV1",
  "$defs": {
    "RepositoryReference": {
      "type": "object",
      "properties": {
        "provider": {
          "type": "string",
          "enum": [
            "github",
            "gitlab",
            "azure-devops",
            "other"
          ]
        },
        "host": {
          "type": "string",
          "minLength": 1,
          "maxLength": 255,
          "pattern": "^[a-z0-9](?:[a-z0-9.-]*[a-z0-9])?$"
        },
        "providerRepositoryId": {
          "type": "string",
          "minLength": 1,
          "maxLength": 255
        },
        "owner": {
          "type": "string",
          "minLength": 1,
          "maxLength": 255
        },
        "name": {
          "type": "string",
          "minLength": 1,
          "maxLength": 255
        }
      },
      "required": [
        "provider",
        "host",
        "providerRepositoryId",
        "owner",
        "name"
      ],
      "additionalProperties": false,
      "description": "A repository reference anchored by the provider-assigned identity; owner and name are mutable display coordinates."
    },
    "Revision": {
      "anyOf": [
        {
          "type": "object",
          "properties": {
            "algorithm": {
              "anyOf": [
                {
                  "type": "string",
                  "enum": [
                    "git-sha1"
                  ]
                }
              ]
            },
            "digest": {
              "type": "string",
              "pattern": "^[0-9a-f]{40}$"
            }
          },
          "required": [
            "algorithm",
            "digest"
          ],
          "additionalProperties": false
        },
        {
          "type": "object",
          "properties": {
            "algorithm": {
              "anyOf": [
                {
                  "type": "string",
                  "enum": [
                    "git-sha256"
                  ]
                }
              ]
            },
            "digest": {
              "type": "string",
              "pattern": "^[0-9a-f]{64}$"
            }
          },
          "required": [
            "algorithm",
            "digest"
          ],
          "additionalProperties": false
        }
      ],
      "description": "An immutable, normalized Git object revision."
    },
    "CatalogSnapshotReference": {
      "type": "object",
      "properties": {
        "sourceRepository": {
          "$ref": "#/$defs/RepositoryReference"
        },
        "revision": {
          "$ref": "#/$defs/Revision"
        },
        "descriptorApiVersion": {
          "anyOf": [
            {
              "type": "string",
              "enum": [
                "argus.dev/repository-descriptor/v1"
              ]
            }
          ]
        }
      },
      "required": [
        "sourceRepository",
        "revision",
        "descriptorApiVersion"
      ],
      "additionalProperties": false,
      "description": "The immutable repository descriptor observation queried by this result page."
    },
    "UtcTimestamp": {
      "type": "string",
      "pattern": "^\\d{4}-\\d{2}-\\d{2}T\\d{2}:\\d{2}:\\d{2}(?:\\.\\d{1,9})?Z$",
      "description": "An RFC 3339 instant normalized to UTC with an explicit Z suffix."
    },
    "LocalKey": {
      "type": "string",
      "minLength": 1,
      "maxLength": 63,
      "pattern": "^[a-z][a-z0-9._-]*$",
      "description": "A stable, repository-declared key. It is scoped by its containing repository or parent declaration."
    },
    "CapabilityReference": {
      "type": "object",
      "properties": {
        "key": {
          "$ref": "#/$defs/LocalKey"
        },
        "name": {
          "type": "string",
          "minLength": 1,
          "maxLength": 255
        }
      },
      "required": [
        "key",
        "name"
      ],
      "additionalProperties": false
    },
    "TestFamily": {
      "type": "string",
      "enum": [
        "unit",
        "component",
        "contract",
        "integration",
        "functional-api",
        "functional-ui",
        "end-to-end",
        "performance",
        "security",
        "resilience",
        "other"
      ]
    },
    "ImpactEdgeStatus": {
      "type": "string",
      "enum": [
        "supported",
        "refuted",
        "stale",
        "conflicting"
      ]
    },
    "ImpactEvidenceProducer": {
      "type": "object",
      "properties": {
        "repository": {
          "$ref": "#/$defs/RepositoryReference"
        },
        "revision": {
          "$ref": "#/$defs/Revision"
        },
        "adapter": {
          "type": "string",
          "minLength": 1,
          "maxLength": 127
        }
      },
      "required": [
        "repository",
        "revision",
        "adapter"
      ],
      "additionalProperties": false,
      "description": "The immutable producer revision and adapter responsible for the evidence bundle."
    },
    "ImpactAssertion": {
      "type": "string",
      "enum": [
        "supports",
        "refutes"
      ],
      "description": "Whether the evidence asserts or contradicts a capability-to-test relationship."
    },
    "ImpactEvidenceType": {
      "type": "string",
      "enum": [
        "explicit",
        "static",
        "dynamic",
        "historical",
        "reviewer-confirmed"
      ],
      "description": "The method that produced one impact observation."
    },
    "ConfidenceBasisPoints": {
      "type": "integer",
      "minimum": 0,
      "maximum": 10000,
      "description": "Producer-specific confidence in basis points. It is evidence metadata, not a universal selection threshold."
    },
    "ImpactEvidenceState": {
      "type": "string",
      "enum": [
        "active",
        "expired"
      ]
    },
    "ImpactEvidenceReference": {
      "type": "object",
      "properties": {
        "producer": {
          "$ref": "#/$defs/ImpactEvidenceProducer"
        },
        "observationKey": {
          "$ref": "#/$defs/LocalKey"
        },
        "assertion": {
          "$ref": "#/$defs/ImpactAssertion"
        },
        "evidenceType": {
          "$ref": "#/$defs/ImpactEvidenceType"
        },
        "confidenceBasisPoints": {
          "$ref": "#/$defs/ConfidenceBasisPoints"
        },
        "rationale": {
          "type": "string",
          "minLength": 1,
          "maxLength": 1024
        },
        "observedAt": {
          "$ref": "#/$defs/UtcTimestamp"
        },
        "expiresAt": {
          "anyOf": [
            {
              "$ref": "#/$defs/UtcTimestamp"
            },
            {
              "type": "null"
            }
          ]
        },
        "state": {
          "$ref": "#/$defs/ImpactEvidenceState"
        }
      },
      "required": [
        "producer",
        "observationKey",
        "assertion",
        "evidenceType",
        "confidenceBasisPoints",
        "rationale",
        "observedAt",
        "expiresAt",
        "state"
      ],
      "additionalProperties": false,
      "description": "One visible evidence observation and its state at the requested evaluation time."
    },
    "MappingConflict": {
      "type": "object",
      "properties": {
        "kind": {
          "anyOf": [
            {
              "type": "string",
              "enum": [
                "contradictory-active-assertions"
              ]
            }
          ]
        },
        "supportingEvidenceCount": {
          "type": "integer",
          "minimum": 1,
          "maximum": 9007199254740991
        },
        "refutingEvidenceCount": {
          "type": "integer",
          "minimum": 1,
          "maximum": 9007199254740991
        }
      },
      "required": [
        "kind",
        "supportingEvidenceCount",
        "refutingEvidenceCount"
      ],
      "additionalProperties": false,
      "description": "A reviewable conflict produced when active evidence both supports and refutes the same edge."
    },
    "ImpactEdge": {
      "type": "object",
      "properties": {
        "capability": {
          "$ref": "#/$defs/CapabilityReference"
        },
        "testRepository": {
          "$ref": "#/$defs/RepositoryReference"
        },
        "suite": {
          "type": "object",
          "properties": {
            "key": {
              "$ref": "#/$defs/LocalKey"
            },
            "family": {
              "$ref": "#/$defs/TestFamily"
            },
            "adapter": {
              "type": "string",
              "minLength": 1,
              "maxLength": 127
            }
          },
          "required": [
            "key",
            "family",
            "adapter"
          ],
          "additionalProperties": false
        },
        "test": {
          "type": "object",
          "properties": {
            "key": {
              "$ref": "#/$defs/LocalKey"
            },
            "name": {
              "type": "string",
              "minLength": 1,
              "maxLength": 255
            }
          },
          "required": [
            "key",
            "name"
          ],
          "additionalProperties": false
        },
        "status": {
          "$ref": "#/$defs/ImpactEdgeStatus"
        },
        "evidence": {
          "type": "array",
          "items": {
            "$ref": "#/$defs/ImpactEvidenceReference"
          },
          "minItems": 1
        },
        "conflict": {
          "anyOf": [
            {
              "$ref": "#/$defs/MappingConflict"
            },
            {
              "type": "null"
            }
          ]
        }
      },
      "required": [
        "capability",
        "testRepository",
        "suite",
        "test",
        "status",
        "evidence",
        "conflict"
      ],
      "additionalProperties": false,
      "description": "A capability-to-test relationship with all visible evidence and its derived state."
    },
    "ContinuationCursor": {
      "type": "string",
      "minLength": 1,
      "maxLength": 4096,
      "pattern": "^[A-Za-z0-9_-]+$",
      "description": "An opaque, versioned continuation token bound to the originating query."
    },
    "ImpactEdgePageV1": {
      "type": "object",
      "properties": {
        "apiVersion": {
          "anyOf": [
            {
              "type": "string",
              "enum": [
                "argus.dev/impact-edge-page/v1"
              ]
            }
          ]
        },
        "snapshot": {
          "$ref": "#/$defs/CatalogSnapshotReference"
        },
        "evaluatedAt": {
          "$ref": "#/$defs/UtcTimestamp"
        },
        "items": {
          "type": "array",
          "items": {
            "$ref": "#/$defs/ImpactEdge"
          }
        },
        "nextCursor": {
          "anyOf": [
            {
              "$ref": "#/$defs/ContinuationCursor"
            },
            {
              "type": "null"
            }
          ]
        }
      },
      "required": [
        "apiVersion",
        "snapshot",
        "evaluatedAt",
        "items",
        "nextCursor"
      ],
      "additionalProperties": false,
      "title": "Argus impact edge page v1",
      "description": "A deterministic page of capability-to-test relationships evaluated at an explicit UTC instant."
    }
  }
}
